{
  "$schema": "../../schemas/project-timeline.schema.json",
  "schema_version": "project.timeline.v2",
  "dataset": "naruto-rpg-project-canon",
  "continuity": "curated_game_canon",
  "calendar": {
    "id": "konoha-360-v1",
    "months_per_year": 12,
    "days_per_month": 30
  },
  "shard": {
    "id": "P2-KAGUYA-FINAL",
    "namespace": "P2",
    "arc_ids": [
      "ARC-P2-KAGUYA-RETURN",
      "ARC-P2-DIMENSION-RESCUE",
      "ARC-P2-TEAM7-SEALING",
      "ARC-P2-WAR-RELEASE",
      "ARC-P2-FINAL-VALLEY",
      "ARC-P2-WAR-SETTLEMENT"
    ],
    "date_start": "K068-02-26",
    "date_end": "K068-03-10"
  },
  "days": [
    {
      "id": "DAY-P2-K-226",
      "date": "K068-02-26",
      "title": "斑背后的最后夺权",
      "arc_id": "ARC-P2-KAGUYA-RETURN",
      "day_goal": "只从 J 实际留下的免疫者和仍可行动者开始，裁定黑绝能否借斑复归辉夜；条件不成立时保留斑、神树或黑绝作为替代最终威胁。",
      "start_state": [
        "J 已逐区记录无限月读成功、局部成功、延期或失败之一；只有名单中的保护者、秽土者和未被照射者仍可自由行动。",
        "斑、黑绝、神树、轮回眼与十尾状态完全沿用 J；不存在的第三只眼、神树或斑肉身不能由“辉夜篇”标题补回。",
        "鸣人、佐助、卡卡西、小樱、带土、玩家和秽土火影只保有 J 结算后的位置、伤势、查克拉、眼睛与亲历知识。"
      ],
      "scenes": [
        {
          "id": "SCN-P2-K-THREAT-GATE-01",
          "title": "黑绝的复归条件",
          "thread_id": "THR-P2-KAGUYA-RETURN",
          "location": "神树根部与斑所在主战场",
          "participants": [
            "宇智波斑",
            "黑绝",
            "漩涡鸣人",
            "宇智波佐助",
            "旗木卡卡西",
            "春野樱",
            "玩家角色（若在 J 的保护圈内）"
          ],
          "resolution_mode": "interactive",
          "requirements": [
            "斑或替代六道级容器仍在主战场。",
            "至少一名 J 名单中的免疫者能观察或干预黑绝。"
          ],
          "blockers": [
            "黑绝已被封印或消灭。",
            "斑肉身、神树连接和可汇聚查克拉三者均不存在。"
          ],
          "setup": "保护圈开启前，仍可行动者先核对斑的肉身、黑绝附着位置、神树连接和轮墓变化；玩家只能选择保护同伴、切断树根或拦截黑绝中的一项。",
          "beats": [
            {
              "id": "EV-P2-K-THREAT-GATE-01-01",
              "order": 10,
              "summary": "佐助以轮回眼确认轮墓是否消失，鸣人以感知确认斑体内尾兽查克拉是否异常回流。",
              "causal_role": "setup"
            },
            {
              "id": "EV-P2-K-THREAT-GATE-01-02",
              "order": 20,
              "summary": "黑绝仅在能接触存活的斑与神树查克拉时刺入其身体，并尝试把受术者查克拉集中到同一容器。",
              "causal_role": "pressure"
            },
            {
              "id": "EV-P2-K-THREAT-GATE-01-03",
              "order": 30,
              "summary": "玩家选择封锁黑绝、维持保护圈或切断最近树根，并接受另一条防线暴露的代价。",
              "causal_role": "choice"
            },
            {
              "id": "EV-P2-K-THREAT-GATE-01-04",
              "order": 40,
              "summary": "现场将结果锁定为辉夜复归、复归被打断、斑继续战斗或黑绝独立逃逸之一。",
              "causal_role": "resolution"
            }
          ],
          "outcomes": [
            "辉夜是否复归有可核对的斑肉身、黑绝意志与神树查克拉来源。",
            "替代路线保留终止无限月读和六道级威胁的同等核心目标。"
          ],
          "state_changes": [
            "斑生命体征、黑绝附着对象、神树输入、轮墓数量、保护圈查克拉和玩家位置被记录。",
            "目击者只知道亲眼看到的变形与攻击，不自动获得黑绝的千年计划。"
          ],
          "stop_condition": "复归或阻断结果不可逆地成立，且仍可行动者完成一次撤离或迎击；不得在本场景直接完成最终封印。",
          "fallbacks": [
            {
              "condition": "辉夜复归条件不成立",
              "status": "altered",
              "direction": "继续对付实际存在的斑、神树或黑绝，并把后续“空间封印”场景改为主战场封印与受术者救援。",
              "preserves": "保留阻止六道级容器吞并世界并解除无限月读的核心冲突。"
            }
          ],
          "source_material": [
            {
              "kind": "manga",
              "reference": "NARUTO 漫画第678-679话",
              "contribution": "提供终局冲突、人物选择与基准结果"
            },
            {
              "kind": "original",
              "reference": "Naruto RPG 项目正史连接段",
              "contribution": "核对 J 的条件分支、免疫名单和现场选择。"
            }
          ],
          "design_rationale": "用四项现实条件约束辉夜入口，并为 J 的失败或延期分支提供真正可玩的替代终局。",
          "reference_facts": [
            "黑绝自称辉夜意志只在其主动披露或证据验证后进入亲历者知识。"
          ]
        },
        {
          "id": "SCN-P2-K-METAMORPHOSIS-01",
          "title": "容器崩解与查克拉洪流",
          "thread_id": "THR-P2-KAGUYA-RETURN",
          "location": "神树根部中央",
          "participants": [
            "大筒木辉夜或实际六道级威胁",
            "宇智波斑",
            "黑绝",
            "漩涡鸣人",
            "宇智波佐助"
          ],
          "resolution_mode": "conditional",
          "requirements": [
            "上一场景已确定最终威胁路线。",
            "鸣佐至少一人仍可观察查克拉与空间变化。"
          ],
          "blockers": [
            "实际威胁已在上一场景被完整封印。",
            "鸣佐均失去行动能力且无人维持保护圈。"
          ],
          "setup": "若复归成立，斑的身体因受术者查克拉灌入而膨胀，轮墓先失联再发生容器置换；若不成立，实际威胁以现有能力发动同等级别的压制。",
          "beats": [
            {
              "id": "EV-P2-K-METAMORPHOSIS-01-01",
              "order": 10,
              "summary": "鸣人与佐助分别确认日月印、轮回眼和尾兽连接仍可用，不把未取得的六道力量补回。",
              "causal_role": "setup"
            },
            {
              "id": "EV-P2-K-METAMORPHOSIS-01-02",
              "order": 20,
              "summary": "查克拉洪流压迫保护圈，任何抽取都按 J 的受术区域而非“全世界”笼统结算。",
              "causal_role": "pressure"
            },
            {
              "id": "EV-P2-K-METAMORPHOSIS-01-03",
              "order": 30,
              "summary": "斑的身体被置换、保留、死亡或从容器排出，黑绝的位置随实际结果更新。",
              "causal_role": "turn"
            },
            {
              "id": "EV-P2-K-METAMORPHOSIS-01-04",
              "order": 40,
              "summary": "当前最终威胁锁定第一组目标和可用能力，战场进入连续追击。",
              "causal_role": "resolution"
            }
          ],
          "outcomes": [
            "最终威胁的身体、尾兽查克拉、眼睛与空间能力形成唯一状态。",
            "斑没有被同时记为辉夜容器、独立战斗者和遗体。"
          ],
          "state_changes": [
            "斑身体与意识状态、辉夜或替代威胁能力、黑绝位置、日月印和保护圈负担被写入。"
          ],
          "stop_condition": "容器置换或替代威胁重组完成，并发动第一次可观察攻击。",
          "fallbacks": [
            {
              "condition": "容器置换未完成或斑保持自主",
              "status": "altered",
              "direction": "由斑或黑绝继续争夺神树控制，后续仅使用其已确认的空间与查克拉能力。",
              "preserves": "保留终局威胁需要被封印而非仅以普通攻击击退。"
            }
          ],
          "source_material": [
            {
              "kind": "manga",
              "reference": "NARUTO 漫画第679话",
              "contribution": "提供终局冲突、人物选择与基准结果"
            },
            {
              "kind": "original",
              "reference": "Naruto RPG 项目正史连接段",
              "contribution": "建立容器、眼睛与查克拉的互斥状态。"
            }
          ],
          "design_rationale": "把“斑变成辉夜”拆为查克拉输入、容器变化和能力确认，避免过场式强制复活。",
          "reference_facts": []
        },
        {
          "id": "SCN-P2-K-DIMENSION-SHIFT-01",
          "title": "第一次空间置换",
          "thread_id": "THR-P2-DIMENSION-RESCUE",
          "location": "主战场至熔岩空间或实际封锁空间",
          "participants": [
            "大筒木辉夜或实际最终威胁",
            "漩涡鸣人",
            "宇智波佐助",
            "旗木卡卡西",
            "春野樱",
            "宇智波带土（若存活）",
            "玩家角色（若在同一保护圈）"
          ],
          "resolution_mode": "interactive",
          "requirements": [
            "最终威胁拥有且实际发动空间置换能力。",
            "参与者在发动瞬间处于已记录覆盖范围。"
          ],
          "blockers": [
            "空间能力被封印或威胁只能留在主战场。",
            "玩家不在保护圈且无空间追踪能力。"
          ],
          "setup": "最终威胁发动一次大范围空间置换；只有置换发动瞬间与其处于同一覆盖层者会被带走，玩家必须依据自身位置决定抓住同伴、维持立足点或留在原战场通报。",
          "beats": [
            {
              "id": "EV-P2-K-DIMENSION-SHIFT-01-01",
              "order": 10,
              "summary": "空间边界出现前，卡卡西和佐助报出保护圈内实际成员，圈外人员不自动同行。",
              "causal_role": "setup"
            },
            {
              "id": "EV-P2-K-DIMENSION-SHIFT-01-02",
              "order": 20,
              "summary": "玩家选择随转移进入、固定一名坠落者或留在原地建立失踪坐标。",
              "causal_role": "choice"
            },
            {
              "id": "EV-P2-K-DIMENSION-SHIFT-01-03",
              "order": 30,
              "summary": "熔岩、冰雪或替代封锁环境立即消耗飞行、通灵、绳索与查克拉，未获救者进入坠落或失联状态。",
              "causal_role": "pressure"
            },
            {
              "id": "EV-P2-K-DIMENSION-SHIFT-01-04",
              "order": 40,
              "summary": "转移名单、原地名单、可用落脚点与第一项跨空间能力冷却被登记。",
              "causal_role": "resolution"
            }
          ],
          "outcomes": [
            "每名关键人物被明确记在目标空间、原战场、失联或受救援中。",
            "玩家选择产生一个有限的救援或通信优势。"
          ],
          "state_changes": [
            "空间编号、转移名单、神威/天手力/通灵使用次数、飞行与绳索负担、原战场通信节点被记录。"
          ],
          "stop_condition": "所有被转移者获得暂时立足点或明确坠落状态，第一次空间能力进入冷却。",
          "fallbacks": [
            {
              "condition": "未发生空间置换",
              "status": "altered",
              "direction": "在主战场以神树裂谷、结界或轮墓形成等价分割，保留同样的名单与救援约束。",
              "preserves": "保留第七班被分割、必须协作重建封印阵型的压力。"
            }
          ],
          "source_material": [
            {
              "kind": "manga",
              "reference": "NARUTO 漫画第679-680话",
              "contribution": "提供终局冲突、人物选择与基准结果"
            },
            {
              "kind": "original",
              "reference": "Naruto RPG 项目正史连接段",
              "contribution": "记录转移清单、环境危害、能力次数和原战场联络。"
            }
          ],
          "design_rationale": "先结算谁被带走和如何存活，阻止角色跨空间无成本聚齐。",
          "reference_facts": []
        }
      ],
      "end_state": [
        "辉夜复归、复归受阻或替代最终威胁之一已经成立，并有唯一身体、眼睛、尾兽查克拉与黑绝状态。",
        "空间置换或等价战场分割后的逐人位置、坠落/受伤、能力冷却与原战场通信节点明确。",
        "无限月读仍按 J 的实际影响持续；尚未获救的受术者不能提供情报或参加战斗。"
      ],
      "transition": "K068-02-27紧接空间分割处理生存、佐助隔离条件和可用救援锚点，不插入治疗或长期休息。",
      "reference_facts": []
    },
    {
      "id": "DAY-P2-K-227",
      "date": "K068-02-27",
      "title": "空间分离与救援锚点",
      "arc_id": "ARC-P2-DIMENSION-RESCUE",
      "day_goal": "在连续威胁下建立环境生存、佐助被分离的实际条件，以及带土、小樱和玩家可承担的有限跨空间搜救。",
      "start_state": [
        "所有人沿用02-26的空间、立足点、伤势与能力冷却；没有进入目标空间者只能通过真实空间术或锚点介入。",
        "鸣人与佐助的日月印必须同时接触目标才可封印；二人之一死亡或未获得印记时改用现有封印资源拖延。",
        "带土只有在 J 中存活、仍可施展神威且未被黑绝完全控制时才可担任空间锚点。"
      ],
      "scenes": [
        {
          "id": "SCN-P2-K-HAZARD-LINE-01",
          "title": "熔岩上方的生存线",
          "thread_id": "THR-P2-DIMENSION-RESCUE",
          "location": "熔岩空间或实际封锁战场",
          "participants": [
            "漩涡鸣人",
            "宇智波佐助",
            "旗木卡卡西",
            "春野樱",
            "玩家角色（若随行）"
          ],